{"version":1,"savedAt":1785321092771,"stableThoughtCount":82,"concepts":[{"id":"c1","labels":["dog","cat","breed, animal, pet, canine","furry, four-legged, loyal"],"prototype":"66xmqrnq0D+5iPGyACUnPUHcSSJQ+dk/34Lfq90J2z/0D2h4cjXQv/iLYjHQCd6/V4wFUfzmx7+FBf0qOEDRP09TSgwgtca/B9Wr+VtRwz9LSVRflwy+vy4QTOcCq9G/LOXHkUi4sD8sBK7tfUe2PwxPlR4rH6s/MESROyQuuD/chjIb2EusPwZfida7qbe/QAea4EVGkL8PuBy3sLiVP/KMhcaxgZG//O7Cpri2jb/YlHWHLDmSv3amAGLdtr2/r7QPizH+i78J/wh+LGCFPyQW7uIj/Hu/OecAUPTcjz8=","semantic":"QOL2bTxwgzwAAAAAAAAAAIXmQaohW9G/qbZ68Z4oxD83l9z1XBjWv2cn91zO1cG/EF11SWtOvD9ieWRjRRasv9Nt3HSQxee/VVnqRGOMob/lZMUP5AnQvzZolGjeQZK/QrjpWR8ivz83fI67IH7CP7hYKCLNRsa/ywF+0JnswD8if17bDVu9v3GnsOz566o/Nb8OynfXeb+cimtev9+SPxI0ustvxL6/oq3FGjGstr/Gwhpbon6wvwPJJhbe0py/qO2bHvaikD/HMxdfLNmfv8rtJcbor62/dY6R2Jcuhr8=","reinforcement":3,"firstSeen":1785240417935,"lastSeen":1785281670970,"sourceTrace":["thought:internal","llm.nameThis","thought:text.feed","thought:llm.answer+text.feed","llm.define"]},{"id":"c2","labels":["dog","cat","puppy","pet","canine"],"prototype":"p+fjJtZmxD87H7sknPQZPQEn57OriNG/n45QtGg60z+uqrRil/LBv8xHVtv0guC/Yi1jnZF50T+WmUpYSAveP26gpnEqHaA/5Qw8U3Xuwz/4BVMxRcB9v4fu2O5qC9i/KMpN5Cc8o78U5GUG33ClvxlvOYcepLG/cpMotVJQwj/0eTyJsGmkP5Kybvt3abu/FtcHcSu0qj/wUXNGhBqwPzE1aCIOXZa/NgtYLIp/pT9X3U03oUiGPz1f+cU8TLm/birdSOA4jr/uU3oZQR6SP26aYG5xn4q/6D6yuxy4oD8=","semantic":"DDGseAoihLwAAAAAAAAAADUK5uCuKeC/0YFeK8Y+2r+PAtZtXdTiv9JYdECmCLc/6/TPcjXZwT/RcLMErKWuP6HE1Avu48q/LJb+hNTsur/ht/iMi37Pv1K8FjwFJqw/0ZdrhFLsnj894V3tfAGav+Eomm1KwcO/njsAbAY1wb8nuRKbtvXCv/wa3Pij5H8/kQ00QakCsD/V6d8x+vilP6hClpx/kaa/XPm5naBzqr+fzlUoXhGpvxP6c+NxV4C/cUHnmfPvg7+E3mwpqquGv2TvvNyItZ+/VipnAHtRob8=","reinforcement":3,"firstSeen":1785281679986,"lastSeen":1785281688995,"sourceTrace":["thought:llm.answer+text.feed","llm.nameThis","thought:llm.answer+text.feed","llm.define"]},{"id":"c3","labels":["cat","dog","feline","mammal","pet","animal","domesticated","carnivore","claws","fur"],"prototype":"caUVamMrwT/DdusNVTAJPXuSFq0T0MC/50D46rtR4T+Xpcju9TSOP0JVlSA/puO/xqD8+Xv9vz8ni+PaqAXPv5WJOjTVKsO/c5u4JCzSyT/sBg9Tj9DBP2aoCkSoYNC/wmDEe91Jtb/+7A4vFCu/P41CA53Hm6Y/O3rN8ihToT8/cs0W6FeuPzru/a2tjcS/NTPlYkaOsb/bLudtcya1v/lqr2g8C40/YOj6lO5XoD+v1Rr3DAN+P8SS4Kqxm5m/E2m1SKOxoz9l5LkAxYJpv5uHQvXQbKy/VjUglu8NhT8=","semantic":"iXv9CaR6kbwAAAAAAAAAAKAiLy+Uh+u/7fvB512ixr++HGkH8RvPvxeXcSQph7A/T2vAMevfvb85/hMpJGyzv/ibD5tJBMy/QVN1VM9Gwz/JfvUCjgi6v5Mz4orBqcK/FUXx2H8jvr9C6yFo8QKkv1zZryTVV7i/m3Pts9nToD+VF6wpUYWvv9OdR4dd+q+/c1EgTaazo7+b0Wxw7+ecv1iMgd8ohK+/ab00s7Z6h7/VlMfWIBGov46jGKUPHaS/V6zZWAx7db/qZtwA5T5cP/20YTe14pa/ZB34Pk2Jh78=","reinforcement":36,"firstSeen":1785281915708,"lastSeen":1785317558678,"sourceTrace":["thought:audio.mic+vision.screen+text.feed","thought:audio.mic+vision.screen","llm.define","thought:audio.mic+vision.screen+llm.answer","llm.define","thought:audio.mic+vision.screen+llm.answer","thought:audio.mic+vision.screen","llm.define"]},{"id":"c4","labels":["dog","cat","puppy","pet","animal","canine","up to 8 related words","bark","furry","tail","loyalty","playfulness"],"prototype":"oANOIg9Jvj+N0uQRq4sIPYbpd5f+YIa/LsUnRHZb1D8gRdBwj1zlvwF2wpmu1uC/ZyoBHxdhxL+YBtLtEvuov40jICTUlqo/bsWao7mExD9pc1xZpajPv2uT+XPsCLC/+bjMHpQjv78ZSKSzXVmRv2wOxsXCv7S/7VCAFJ38sr8IrIpW0Tqhv+Uc9Ym6upS/sTzzgYF5iD/t+nAK3uWiP7aDDtMR0aO/DvHxPIHQdz8uNHQ5hBGavyF3tHP/kLG/2Lm/FIF5qb/gGDXsU4KDv19SiI4BQKK/F7mHE0WsfL8=","semantic":"rfUIYaPwl7wAAAAAAAAAAJP9U8W9b5y/lh7rgiYeob9O95HO6B3hvx4O3o39o+O/bUtJm9sYur88xG9XrFO+v67lXGO4/Jw/JRIcr9061T+6CjOcHO/Rv/5RymYwfL8/WpPcDxyiyj/ZOJPqcBPFv7XwbiAXDbO/nunc96d4o7+bmJQkK4rBvzNPyp/4C5E/NVMg3i14Y7+F0eZ7lteUP9uNgYcHXp4/C5oO7OONpr+myowkdg91v2QEgP1ekWa/qV6aSk22sb+9RZ6I6hWBvzYv6bpjz6C/gXCy8H9gm78=","reinforcement":32,"firstSeen":1785317564971,"lastSeen":1785317728026,"sourceTrace":["thought:vision.screen+audio.mic+llm.answer","llm.define","thought:audio.mic+vision.screen+llm.answer","llm.define","thought:audio.mic+llm.answer+vision.screen","thought:audio.mic+vision.screen","thought:vision.screen+audio.mic","llm.define"]},{"id":"c5","labels":["cat","dog"],"prototype":"yojkppwi5z9pFNvIl8wzPVrSmLfphc6/cxcPExCu3T+amF+L2bvBv+aqfzZvEta/GPS+zY3YxT/3iIvfXZ4jv1mtyfvylrC/7KNDuuNOwD9dHqBIB8Gav1frf7pIfru/e7nQruKgpD8dzdNbeoYSv64weTdmC5W/KmcubX+Joz96WH/YMOdVv+1BFtJOLaO/JK8MDZV6gz9CthVeRz36vlwwFAYdLYC/VvVSFR+7iT8MzHvB4spmPw2CdTcbbI2/l/ckRq1kYj+kIg8On4TgvljJ33hpJ22/mWN/c5hecj8=","semantic":"YUxR8TUppLwAAAAAAAAAADPMk8253eO/nC8niGnu0r87dRa4l3Tgv0K6LOV1W8U/V6PdBtEogby04rLWoJizvIG54BJe8NG/4EF+njhHx7+w6o8G4IfQv1zwAqabdKg/PZDkO10gejwZtGqcinKyvL3frtj3nL+/Ptb+Ci76ur8Y5L5mWFDAv38h+j/LJns/l+1dEwErjbx1fWE3Wt+WPGJBNFwHCau/2Rlk2gcArr8YkH+wR6avv11VC1PfBnS/5qbPi5zejjwrPYl7FmuevJ3orQ3OPZa/7LKp53cqoL8=","reinforcement":8,"firstSeen":1785317742451,"lastSeen":1785321092769,"sourceTrace":["thought:vision.screen+audio.mic","thought:audio.mic+vision.screen","thought:vision.screen+audio.mic","thought:text.feed","llm.nameThis","thought:internal","thought:text.feed","thought:internal"]}]}